{
    "$schema": "https://json-schema.org/draft/2020-12/schema",
    "$id": "https://dfc/schemas/stations/fleet_station.json",
    "title": "DFC Fleet Space Station",
    "type": "object",
    "required": ["Name", "Fleet", "Size", "Points", "BaseSize", "Profile", "Weapons", "Load"],
    "additionalProperties": false,
    "properties": {
        "Fleet":     { "type": "string" },
        "Name":      { "type": "string" },
        "Size":      { "type": "string", "enum": ["Small", "Medium", "Large"] },
        "Points":    { "type": "integer" },
        "BaseSize":  { "type": "integer" },
        "Profile":   { "$ref": "https://dfc/schemas/stations/defs.json#/$defs/StationProfile" },
        "Weapons": {
            "type": "array",
            "items": { "$ref": "https://dfc/schemas/defs.json#/$defs/Weapon" }
        },
        "Load": {
            "type": "array",
            "items": { "$ref": "https://dfc/schemas/defs.json#/$defs/LoadEntry" }
        },
        "Rules": {
            "type": "array",
            "items": { "$ref": "https://dfc/schemas/defs.json#/$defs/Rule" }
        }
    }
}
