{
    "Fleet": "Resistance",
    "Name": "Astrobotanical Outpost",
    "Size": "Medium",
    "Points": 85,
    "BaseSize": 40,
    "Profile": {
        "Scan": 6,
        "Sig": 6,
        "Hull": 14,
        "ES": "3+",
        "KS": "5+",
        "BS": "-",
        "G": "1",
        "Special": []
    },
    "Weapons": [
        {
            "Name": "Heavy Vent Cannon Turret",
            "Arc": "F/S/R",
            "Att": 2,
            "Lock": "3+",
            "DMG": 2,
            "Type": "E",
            "Special": [
                "Fusillade-1",
                "Overcharge",
                "Reave-1"
            ],
            "Rule": "When you assign targets to this weapon, you may have this Space Station gain 2 Spikes, if you do, it counts as going on Weapons Free Orders for the purposes of its Special rules."
        }
    ],
    "Load": [],
    "Rules": [
        {
            "Name": "Signature Bloom",
            "Text": "Friendly Ships within 6\" of this Space Station are Hidden within its Bloom. Enemy Ships targeting a Hidden Ship's Group ignore a Spike for each Hidden Ship in that Group.\nThis rule has no effect while this Space Station is controlled by an enemy player."
        }
    ]
}